{
  "market": "JP",
  "version": "1.1.0",
  "last_verified": "2026-07-07",
  "verified_by": "human",
  "legal_basis": "医薬品医療機器等法(薬機法) 66条・68条(誇大広告・未承認効能の禁止) 및 化粧品等の適正広告ガイドライン(日本化粧品工業会 2020), 景品表示法(最大級表現)",
  "source_urls": [
    "https://www.jcia.org/user/common/download/business/advertising/JCIA20200615_ADguide.pdf",
    "https://www.89ji.com/guide/cosmetic-p2.html",
    "https://www.yakujihou.com/rule/bihaku/",
    "https://ec-lawyer.com/131/"
  ],
  "rules": [
    {
      "id": "JP-001",
      "category": "치료적 효능 표현 금지 (シミ除去)",
      "ng_patterns": [
        "シミを消す",
        "しみを消す",
        "シミが消える",
        "기미.{0,8}(지워|지우|없애|제거)",
        "기미 제거"
      ],
      "severity": "VIOLATION",
      "reason": "既にできたシミを消す・治すは化粧品の効能範囲を超える治療的表現。薬機法66条違反。",
      "condition": "予防表現(日焼けによるシミ・そばかすを防ぐ)のみ許容",
      "alternatives": [
        "日焼けによるシミ・そばかすを防ぐ",
        "メラニンの生成を抑える(医薬部外品承認時)"
      ]
    },
    {
      "id": "JP-002",
      "category": "美白・漂白 표현 (一般化粧品)",
      "ng_patterns": [
        "美白",
        "肌が白くなる",
        "肌を白く",
        "ホワイトニング",
        "미백"
      ],
      "severity": "VIOLATION",
      "reason": "一般化粧品で肌本来の色が白くなる「美白」表現は不可。ホワイトニングは漂白の誤認を招く。",
      "condition": "医薬部外品で美白有効成分の承認があり、作用機序(メラニンの生成を抑え、しみ・そばかすを防ぐ)を併記する場合のみ「美白」使用可",
      "alternatives": [
        "透明感のある印象へ",
        "メーキャップ効果で明るい肌印象",
        "うるおいで肌を整える"
      ]
    },
    {
      "id": "JP-003",
      "category": "再生・細胞レベル 표현 금지",
      "ng_patterns": [
        "再生",
        "肌を蘇らせ",
        "細胞から",
        "되살",
        "재생"
      ],
      "severity": "VIOLATION",
      "reason": "肌の再生・蘇生・細胞レベルへの作用は化粧品の効能範囲を逸脱する治療的表現。薬機法違反。",
      "alternatives": [
        "キメを整える",
        "うるおいのあるすこやかな肌へ",
        "ハリのある肌印象へ"
      ]
    },
    {
      "id": "JP-004",
      "category": "最大級・No.1 표현 (景表法)",
      "ng_patterns": [
        "1位",
        "1위",
        "No\\.?1",
        "販売No",
        "売上No",
        "最高",
        "최고"
      ],
      "severity": "WARNING",
      "reason": "「販売1位」「No.1」等の最大級表現は客観的根拠・調査出典の明記が必須(景品表示法)。根拠なき場合は優良誤認。",
      "condition": "第三者調査の出典・調査期間・対象を明記する場合に限り許容",
      "alternatives": [
        "満足度調査で高評価",
        "リピート率○%(出典明記)"
      ]
    },
    {
      "id": "JP-005",
      "category": "若返り・年齢逆行 표현 금지",
      "ng_patterns": [
        "若返",
        "若返り",
        "年齢を巻き戻",
        "젊어진",
        "젊어지",
        "\\d+年.{0,4}若",
        "\\d+년.{0,4}젊",
        "나이를 되돌"
      ],
      "severity": "VIOLATION",
      "reason": "「若返る」「年齢を巻き戻す」等は加齢を逆行させる治療的・誇大表現で化粧品の効能範囲を逸脱。薬機法66条違反。",
      "alternatives": [
        "年齢に応じたうるおいケア",
        "ハリ・キメを整えた印象へ",
        "乾燥による年齢サインを目立たなくする"
      ]
    },
    {
      "id": "JP-006",
      "category": "シワ除去・改善 표현 (효능 범위 초과)",
      "ng_patterns": [
        "シワを消す",
        "しわを消す",
        "シワが消える",
        "シワを改善",
        "シワをなくす",
        "주름.{0,10}(지워|지우|없애|제거|개선)",
        "주름 제거"
      ],
      "severity": "VIOLATION",
      "reason": "一般化粧品でシワを消す・改善・除去は効能範囲外。化粧品で許容されるのは「乾燥による小じわを目立たなくする」の範囲のみ。薬機法違反。",
      "condition": "「乾燥による小じわを目立たなくする」表現のみ許容(効能評価試験を経た薬用化粧品はこの限りでない)",
      "alternatives": [
        "乾燥による小じわを目立たなくする",
        "うるおいでキメを整えハリのある肌印象へ"
      ]
    }
  ]
}